{
  "$schema": "https://fieldunit.org/schema/v1/interlocking-plant.schema.json",
  "version": "1.0.0",
  "name": "CP_GilroyInterchange",
  "design": {
    "status": "incomplete"
  },
  "defaultAspectPolicy": "sp1969",
  "trackCircuits": [
    {
      "name": "1T1",
      "dropoutDelayMs": 0
    },
    {
      "name": "3T1",
      "dropoutDelayMs": 0
    },
    {
      "name": "TK1",
      "dropoutDelayMs": 0
    }
  ],
  "switches": [
    {
      "name": "1"
    },
    {
      "name": "3"
    }
  ],
  "crossovers": [],
  "signalControls": [],
  "signalMasts": [],
  "detectorLocks": [
    {
      "switch": "1",
      "trackCircuit": "1T1"
    },
    {
      "switch": "3",
      "trackCircuit": "3T1"
    }
  ],
  "routes": []
}