{
  "name": "CP_GilroyCaltrain",
  "defaultAspectPolicy": "sp1969",
  "trackCircuits": [
    {
      "name": "1T1",
      "dropoutDelayMs": 0
    },
    {
      "name": "EA1",
      "dropoutDelayMs": 0
    },
    {
      "name": "TK1",
      "dropoutDelayMs": 0
    },
    {
      "name": "TK2",
      "dropoutDelayMs": 0
    },
    {
      "name": "TK3",
      "dropoutDelayMs": 0
    }
  ],
  "switches": [
    {
      "name": "1"
    },
    {
      "name": "3"
    }
  ],
  "crossovers": [],
  "signalControls": [],
  "signalMasts": [],
  "detectorLocks": [
    {
      "switch": "1",
      "trackCircuit": "1T1"
    },
    {
      "switch": "3",
      "trackCircuit": "1T1"
    }
  ],
  "routes": []
}